{
    "schemaVersion": "refs/1.0.0",
    "spec": {
        "currentVersion": "4.3.0",
        "recommendedRelease": "v4.3.0",
        "historicalVersions": [ "4.0.0", "4.1.0", "4.2.0", "4.3.0" ],
        "specDir": "spec/v4.3.0",
        "miniSkillTemplate": "data/mini-skill.template.md"
    },
    "grading": {
        "currentVersion": "3.0.0",
        "recommendedRelease": "3.0.0",
        "specDir": "grading/3.0.0",
        "url": "https://flowmcp.github.io/grading/overview/"
    },
    "bestPractice": {
        "currentVersion": "0.1.0",
        "recommendedRelease": "0.1.0",
        "specDir": "best-practice/0.1.0",
        "url": "https://flowmcp.github.io/best-practice/overview/"
    },
    "imports": {
        "cli": "github:FlowMCP/flowmcp-cli#v4.1.0",
        "core": "github:FlowMCP/flowmcp-core#v4.1.0",
        "schemasPublic": "github:FlowMCP/flowmcp-schemas-public#main",
        "gtfsToolkit": "github:FlowMCP/geo-gtfs-toolkit#v1.0.0"
    },
    "docs": {
        "canonical": "https://flowmcp.github.io",
        "entryPoints": {
            "hackathon": "/quickstart/quickstart/",
            "aiEngineer": "/specification/overview/",
            "schemaMaintainer": "/specification/schema-format/",
            "decisionMaker": "/about/for-decision-makers/"
        }
    },
    "github": {
        "organization": "https://github.com/flowmcp",
        "specRepo": "https://github.com/FlowMCP/flowmcp-spec",
        "sponsorsUrl": "https://github.com/sponsors/FlowMCP"
    },
    "llmsFiles": {
        "indexUrl": "https://flowmcp.github.io/llms.txt",
        "docsUrl": "https://flowmcp.github.io/docs-llms.txt",
        "fullUrl": "https://flowmcp.github.io/llms-full.txt",
        "specUrl": "https://raw.githubusercontent.com/FlowMCP/flowmcp-spec/main/generated/llms.txt"
    },
    "robotsTxt": {
        "publishedLlmsFiles": [
            "/llms.txt",
            "/docs-llms.txt",
            "/llms-full.txt"
        ]
    },
    "addons": [
        {
            "name": "geo-gtfs-toolkit",
            "import": "github:FlowMCP/geo-gtfs-toolkit",
            "description": "Convert GTFS Schedule feeds to a sealed SQLite database (source-key: sqlite-gtfs)"
        },
        {
            "name": "geo-geojson-toolkit",
            "import": "github:FlowMCP/geo-geojson-toolkit",
            "description": "Load a GeoJSON FeatureCollection from a URL into memory for spatial queries (source-key: geo-geojson)"
        },
        {
            "name": "geo-csv-tsv-toolkit",
            "import": "github:FlowMCP/geo-csv-tsv-toolkit",
            "description": "Load geo CSV/TSV from a URL into memory with a mandatory parse config (source-key: geo-csv)"
        },
        {
            "name": "geo-overpass-toolkit",
            "import": "github:FlowMCP/geo-overpass-toolkit",
            "description": "Run live HTTP Overpass queries against OpenStreetMap with caching (source-key: geo-overpass)"
        }
    ]
}
